{"$schema":"https://json-schema.org/draft/2020-12/schema","$id":"https://shabilev.github.io/aos/known-issues.schema.json","title":"Known Issues","type":"object","required":["schemaVersion","updatedAt","active","history"],"properties":{"schemaVersion":{"type":"string"},"updatedAt":{"type":"string"},"active":{"type":"array","maxItems":50,"items":{"type":"object","required":["id","date","command","symptom","rootCause","fix","preventionTest","status","affectedRelease","evidencePath"],"properties":{"id":{"type":"string"},"date":{"type":"string"},"command":{"type":"string"},"symptom":{"type":"string"},"rootCause":{"type":"string"},"fix":{"type":"string"},"preventionTest":{"type":"string"},"status":{"type":"string"},"affectedRelease":{"type":"string"},"evidencePath":{"type":["string","null"]}}}},"history":{"type":"array","maxItems":20,"items":{"type":"object"}}}}
